{
  "blockers": [
    "configuration_versions_required",
    "image_dimensions_required",
    "image_mime_type_required",
    "operation_authority_required",
    "page_visual_selection_required",
    "quality_thresholds_required",
    "video_exact_sha256_required",
    "video_mime_type_required",
    "video_stratification_metadata_required"
  ],
  "candidate_set_state": "frozen",
  "documents": [
    {
      "asset_id": "asset_njp_video_library_8cdd40af1169a36699fbfcd9",
      "blockers": [
        "operation_authority_required"
      ],
      "candidate_id": "document_candidate_a4d649aa90cbbe03ebb0d50e",
      "candidate_kind": "document",
      "candidate_sha256": "bcd69fac5ee60e9193d4695f1cea22a3dc569e2af86f3457aa9c078756aa4a66",
      "control_role": "primary",
      "duration_seconds": null,
      "execution_state": "held",
      "height_pixels": null,
      "mime_type": "application/pdf",
      "object_key": "njpvideo/pdf/105167.pdf",
      "object_receipt_sha256": "b7041d9475709294cbbe982dbf8c1b06eaac457388fdcdd51d14aea3610509b5",
      "object_sha256": "3dee12b22dd3ee9acd3dee92830275b855d0b8dd46a5601565072b489e905cc2",
      "ordinal": 1,
      "page_count": 15,
      "selection_rationale_code": "stable_hash_rank",
      "size_bytes": 8002830,
      "source_id": "njp-video-library",
      "source_record_id": "105167",
      "storage_record_id": "105167",
      "width_pixels": null
    },
    {
      "asset_id": "asset_njp_video_library_712d5dc6d350e458ca3c2a81",
      "blockers": [
        "operation_authority_required"
      ],
      "candidate_id": "document_candidate_9c1b44d9eb7839da721c1408",
      "candidate_kind": "document",
      "candidate_sha256": "e72460a10e9ba15aab2680609b4a932429fb78aa9b5071f55e00827a5f235dcb",
      "control_role": "primary",
      "duration_seconds": null,
      "execution_state": "held",
      "height_pixels": null,
      "mime_type": "application/pdf",
      "object_key": "njpvideo/pdf/105153.pdf",
      "object_receipt_sha256": "67dc040b44aac9e8b5364abb93af11046a54aa618f2ee18e843853e4f6c5bc87",
      "object_sha256": "1ee3cff57e7c5aebf203b6ddbf38f6458a333b02f5140fe9be1f5aff72ab80ee",
      "ordinal": 2,
      "page_count": 10,
      "selection_rationale_code": "stable_hash_rank",
      "size_bytes": 294871,
      "source_id": "njp-video-library",
      "source_record_id": "105153",
      "storage_record_id": "105153",
      "width_pixels": null
    },
    {
      "asset_id": "asset_njp_video_library_d1442c1338c98c0bae44010f",
      "blockers": [
        "operation_authority_required"
      ],
      "candidate_id": "document_candidate_9cb66a9336e902773b2f8d3a",
      "candidate_kind": "document",
      "candidate_sha256": "afecfca0b1754c26a52ac0cb75b4382fa8e842803a31a92e679812967a624865",
      "control_role": "primary",
      "duration_seconds": null,
      "execution_state": "held",
      "height_pixels": null,
      "mime_type": "application/pdf",
      "object_key": "njpvideo/pdf/105144.pdf",
      "object_receipt_sha256": "dd312c095b85a944b5ec1d23c1e7f1994c4d5323f244f013486e4925445e9a34",
      "object_sha256": "a59d0416fc5333d3e479f5d06c56be5685a2c0115d0ac5d09328007bc859f218",
      "ordinal": 3,
      "page_count": 7,
      "selection_rationale_code": "stable_hash_rank",
      "size_bytes": 4963967,
      "source_id": "njp-video-library",
      "source_record_id": "105144",
      "storage_record_id": "105144",
      "width_pixels": null
    },
    {
      "asset_id": "asset_njp_video_library_0a0398497f1d90062c6adaa6",
      "blockers": [
        "operation_authority_required"
      ],
      "candidate_id": "document_candidate_16e523193f75657c9b888eb4",
      "candidate_kind": "document",
      "candidate_sha256": "af3954caaa03572275d8e960ec7bac08df204c29268bd4bcfe87a4e90eb78842",
      "control_role": "primary",
      "duration_seconds": null,
      "execution_state": "held",
      "height_pixels": null,
      "mime_type": "application/pdf",
      "object_key": "njpvideo/pdf/105126.pdf",
      "object_receipt_sha256": "b346a4213b25f450bd40c6ff25e757bee3cdedb09b9b2fe0ef7d9a3a729c8bc1",
      "object_sha256": "798198f15ed4124ba59ba2a71f6c2a7ce9443f288a96d30cb78de0d4720e5168",
      "ordinal": 4,
      "page_count": 14,
      "selection_rationale_code": "stable_hash_rank",
      "size_bytes": 9652925,
      "source_id": "njp-video-library",
      "source_record_id": "105126",
      "storage_record_id": "105126",
      "width_pixels": null
    },
    {
      "asset_id": "asset_njp_video_library_c894f9323a0cba01e78fc8ad",
      "blockers": [
        "operation_authority_required"
      ],
      "candidate_id": "document_candidate_1246c0c0933cafc5a12d76ce",
      "candidate_kind": "document",
      "candidate_sha256": "74ac1b8549ea4e9ba9eb6dcc09429e8945aa587b08f3161c0e5703b5558a415e",
      "control_role": "primary",
      "duration_seconds": null,
      "execution_state": "held",
      "height_pixels": null,
      "mime_type": "application/pdf",
      "object_key": "njpvideo/pdf/105182.pdf",
      "object_receipt_sha256": "a14f5fa5499abe3786bfbb883683935c876b1996631c1519a101d1c4f2bfef7b",
      "object_sha256": "84e798e0a3b4ee0ab6ff1f78a59889a265cbd6ade52e1b9d0008667867f132f3",
      "ordinal": 5,
      "page_count": 13,
      "selection_rationale_code": "stable_hash_rank",
      "size_bytes": 11341994,
      "source_id": "njp-video-library",
      "source_record_id": "105182",
      "storage_record_id": "105182",
      "width_pixels": null
    },
    {
      "asset_id": "asset_njp_video_library_6280a192ba6b5caf507940a4",
      "blockers": [
        "operation_authority_required"
      ],
      "candidate_id": "document_candidate_f213a3dffcd9387809f99339",
      "candidate_kind": "document",
      "candidate_sha256": "48fdb8519050112baa48946806093e6f49428cc1b34726a9441314b247068b86",
      "control_role": "primary",
      "duration_seconds": null,
      "execution_state": "held",
      "height_pixels": null,
      "mime_type": "application/pdf",
      "object_key": "njpvideo/pdf/105161.pdf",
      "object_receipt_sha256": "95fc5dd96e9438f6fb11810b48e9c9d77c067b2ba43e64318a26ce622335c1e4",
      "object_sha256": "799a0a0ff9b4078b2c220d360c1db51ab4612d6dc1762b7023773e5573a7ecb5",
      "ordinal": 6,
      "page_count": 36,
      "selection_rationale_code": "stable_hash_rank",
      "size_bytes": 23911190,
      "source_id": "njp-video-library",
      "source_record_id": "105161",
      "storage_record_id": "105161",
      "width_pixels": null
    },
    {
      "asset_id": "asset_njp_video_library_a1269d0bc1fae6f78d63de4b",
      "blockers": [
        "operation_authority_required"
      ],
      "candidate_id": "document_candidate_21be0c5857cac010184c6627",
      "candidate_kind": "document",
      "candidate_sha256": "20c5054be318f5b45422f5b32ddad4b78da63dd981be8d44e68d2ace9e0897c0",
      "control_role": "primary",
      "duration_seconds": null,
      "execution_state": "held",
      "height_pixels": null,
      "mime_type": "application/pdf",
      "object_key": "njpvideo/pdf/105173.pdf",
      "object_receipt_sha256": "ee99834ce4bd9b45406e9c9d5a941b763304206f9801899eb567df5be0758e49",
      "object_sha256": "a8d04b9285b4d6d807c3854fd6a4791070ef1c72ab45d88bca3145b8c1f02ed3",
      "ordinal": 7,
      "page_count": 8,
      "selection_rationale_code": "stable_hash_rank",
      "size_bytes": 5127791,
      "source_id": "njp-video-library",
      "source_record_id": "105173",
      "storage_record_id": "105173",
      "width_pixels": null
    },
    {
      "asset_id": "asset_njp_video_library_ce232de4e1109157ca782b4a",
      "blockers": [
        "operation_authority_required"
      ],
      "candidate_id": "document_candidate_17fdc6b841258cbbe4eda4ff",
      "candidate_kind": "document",
      "candidate_sha256": "c9dd1594279e6da51222d8a8298330237cda5ae3b11eef5aedb6e1bc53257883",
      "control_role": "primary",
      "duration_seconds": null,
      "execution_state": "held",
      "height_pixels": null,
      "mime_type": "application/pdf",
      "object_key": "njpvideo/pdf/105152.pdf",
      "object_receipt_sha256": "51887cc23dcd53116344c0ecea4488a587666b7f661e7bbadd3f212a6b9a0505",
      "object_sha256": "73a3a6c34c9e20d88e37b1eca9e4d643a6381915014c4e387e86cc0450a69a89",
      "ordinal": 8,
      "page_count": 18,
      "selection_rationale_code": "stable_hash_rank",
      "size_bytes": 3929249,
      "source_id": "njp-video-library",
      "source_record_id": "105152",
      "storage_record_id": "105152",
      "width_pixels": null
    },
    {
      "asset_id": "asset_njp_video_library_dd3304d7057e4b1e8f43b61d",
      "blockers": [
        "operation_authority_required"
      ],
      "candidate_id": "document_candidate_8e845e44921e13d9c048924d",
      "candidate_kind": "document",
      "candidate_sha256": "02650be1810a4102cc9865ef2958d031233359c358bd259594f61550c33496c0",
      "control_role": "primary",
      "duration_seconds": null,
      "execution_state": "held",
      "height_pixels": null,
      "mime_type": "application/pdf",
      "object_key": "njpvideo/pdf/105166.pdf",
      "object_receipt_sha256": "41d5e2f38adfaf2f35762d974e38fd6ea1241a12316c47afbb9e966715a436bb",
      "object_sha256": "c82a187a2e76af104b7ad7b0c319d697b6aa263da466d2bfe48c90d75517d36d",
      "ordinal": 9,
      "page_count": 5,
      "selection_rationale_code": "stable_hash_rank",
      "size_bytes": 2510457,
      "source_id": "njp-video-library",
      "source_record_id": "105166",
      "storage_record_id": "105166",
      "width_pixels": null
    },
    {
      "asset_id": "asset_njp_video_library_1d218ca349b4bd2fa1da17c9",
      "blockers": [
        "operation_authority_required"
      ],
      "candidate_id": "document_candidate_7529934adec3fcf9c4149a3d",
      "candidate_kind": "document",
      "candidate_sha256": "2c4c500b68d63f9184aa691e6531af2b94f9bc5aa25ade30e7ceee2b0221e476",
      "control_role": "primary",
      "duration_seconds": null,